{
  "dataset_id": "demo_permutation_001",
  "name": "Demonstration Dataset - Permutations and Recursion",
  "category": "mathematical",
  "source": {
    "platform": "synthetic-generation",
    "url": "internal-demonstration"
  },
  "ingestion": {
    "first_ingested": "2025-12-20T23:39:33.872559Z",
    "last_updated": "2025-12-20T23:39:33.872570Z",
    "frequency": "on-demand",
    "status": "completed"
  },
  "statistics": {
    "record_count": 5,
    "size_bytes": 4244,
    "version": "demo-1.0"
  },
  "schema_reference": "recursive_annotation,combinatorial_algebra",
  "quality_metrics": {
    "completeness": 1.0,
    "consistency": 1.0,
    "validation_passed": true
  },
  "tags": [
    "demonstration",
    "permutations",
    "recursion",
    "symmetric-group"
  ],
  "description": "Demonstration dataset showing recursive functions and permutation group structures"
}